{
  "bundle_metadata": {
    "bundle_id": "bundle.speckify-planning-export",
    "schema_version": 1,
    "bundle_version": 1,
    "generated_at": "2026-04-20T14:00:00Z",
    "source_model_id": "speckify-planning-export",
    "source_model_version": 1,
    "decomposition_profile": "rupify-split-dependencies-v1"
  },
  "source_summary": {
    "source_system": "rupify",
    "project_id": "speckify-planning-export",
    "project_name": "speckify-planning-export",
    "export_version": 1,
    "notes": [
      "Generated directly from imported Rupify planning export records.",
      "First-pass decomposition splits selected ready normative source elements into smaller planning units.",
      "Deterministic dependency edges and assembly rules are derived for split workflow and transition chains."
    ]
  },
  "source_anchors": [],
  "spec_units": [],
  "implementation_units": [],
  "verification_units": [],
  "trace_bundles": [],
  "dependency_edges": [],
  "assembly_rules": [],
  "unresolved_ambiguities": [],
  "rendered_issues": []
}